Handle,Title,Body (HTML),Vendor,Type,Tags,Published,Option1 Name,Option1 Value,Variant SKU,Variant Grams,Variant Inventory Tracker,Variant Inventory Qty,Variant Inventory Policy,Variant Fulfillment Service,Variant Price,Variant Requires Shipping,Variant Taxable,Variant Barcode,Image Src,Image Position,Gift Card,Status
palinca-visine-campion,Pălincă de Vișine — Campion Quintessence 2025,"<p><strong>Titlu de Campion la Quintessence 2025.</strong> O pălincă de vișine de excepție, distilată cu pasiune pe Valea Ierului. Aromă intensă și catifelată, cu un final lung și elegant care păstrează tot sufletul fructului.</p><p>Volum: 0.5 L · Tărie alcoolică: 50% vol.</p>",Zekulhyda,Pălincă,"campion,premiat,visine,premium",TRUE,Volum,0.5 L,ZK-VIS-050,800,shopify,50,deny,manual,200.00,TRUE,TRUE,,,1,FALSE,active
palinca-mere-barrique,Pălincă de Mere Barrique — Campion Quintessence 2025,"<p><strong>Titlu de Campion la Quintessence 2025.</strong> Pălincă de mere maturată în butoaie barrique, care îmbină tradiția cu rafinamentul. Note delicate de lemn de stejar, rotunjite de timp și măiestrie.</p><p>Volum: 0.5 L · Tărie alcoolică: 50% vol.</p>",Zekulhyda,Pălincă,"campion,premiat,mere,barrique,premium",TRUE,Volum,0.5 L,ZK-MER-050,800,shopify,50,deny,manual,200.00,TRUE,TRUE,,,1,FALSE,active
palinca-pere-carmen,"Pălincă de Pere ""Carmen""","<p>Câștigătoare a premiului publicului la Quintessence 2024. O pălincă de pere fină și aromată, cu prospețime fructată și un caracter distinct care cucerește.</p><p>Volum: 0.5 L · Tărie alcoolică: 50% vol.</p>",Zekulhyda,Pălincă,"premiat,pere,carmen,premium",TRUE,Volum,0.5 L,ZK-PER-050,800,shopify,50,deny,manual,132.00,TRUE,TRUE,,,1,FALSE,active
palinca-prune,Pălincă de Prune,"<p>Pălincă tradițională de prune, distilată cu strictețe și răbdare. Echilibrată, autentică și plină de caracter — esența pălincii de pe Valea Ierului.</p><p>Volum: 0.5 L · Tărie alcoolică: 50% vol.</p>",Zekulhyda,Pălincă,"prune,traditional,premium",TRUE,Volum,0.5 L,ZK-PRU-050,800,shopify,50,deny,manual,105.00,TRUE,TRUE,,,1,FALSE,active
palinca-caise,Pălincă de Caise,"<p>Pălincă de caise cu aromă bogată și catifelată, captând întreaga dulceață și prospețime a fructului copt la soare. Un destilat fin, premiat la competiții internaționale.</p><p>Volum: 0.5 L · Tărie alcoolică: 50% vol.</p>",Zekulhyda,Pălincă,"caise,premiat,premium",TRUE,Volum,0.5 L,ZK-CAI-050,800,shopify,50,deny,manual,132.00,TRUE,TRUE,,,1,FALSE,active
palinca-gutui,Pălincă de Gutui,"<p>Pălincă de gutui aromată și nobilă, cu un parfum inconfundabil și o textură fină. Un destilat rar, pentru cunoscători.</p><p>Volum: 0.5 L · Tărie alcoolică: 50% vol.</p>",Zekulhyda,Pălincă,"gutui,premium",TRUE,Volum,0.5 L,ZK-GUT-050,800,shopify,50,deny,manual,132.00,TRUE,TRUE,,,1,FALSE,active
